{
  "id": "wave",
  "duration": 2,
  "loop": true,
  "tracks": [
    {
      "param": "px",
      "keys": [
        {
          "t": 0,
          "v": -1
        },
        {
          "t": 1,
          "v": 1,
          "ease": "bezier",
          "cp": [
            0.4,
            0,
            0.6,
            1
          ]
        },
        {
          "t": 2,
          "v": -1,
          "ease": "bezier",
          "cp": [
            0.4,
            0,
            0.6,
            1
          ]
        }
      ]
    },
    {
      "param": "py",
      "keys": [
        {
          "t": 0,
          "v": 0
        },
        {
          "t": 0.5,
          "v": 0.8,
          "ease": "step"
        },
        {
          "t": 1.5,
          "v": -0.4,
          "ease": "bezier",
          "cp": [
            1,
            0,
            1,
            1
          ]
        },
        {
          "t": 2,
          "v": 0,
          "ease": "linear"
        }
      ]
    }
  ]
}
